<?xml version="1.0" encoding="UTF-8" standalone="no"?>
<!-- SISTEMA-TRANSFORMACION-MIGUEL-AMARÍS -->
<tf:sistemaTF 
xmlns:xsi="http://www.w3.org/2001/XMLSchema-instance" 
xmlns:tf="http://www.piat.upm.es/sistemaTransformacion" 
xmlns:mod="http://www.piat.upm.es/modulo"
xsi:schemaLocation="http://www.piat.upm.es/sistemaTransformacion sistemaTransformacion.xsd" 
idSistemaTF="TF002">

    <tf:informacionEntrada>
        <tf:valor>
            <tf:parametro>asdasd</tf:parametro>
            <tf:medida>
                <mod:valor>54</mod:valor>
                <mod:unidades>m^2</mod:unidades>
            </tf:medida>
        </tf:valor>
    </tf:informacionEntrada>

    <tf:informacionSalida>
       <tf:texto formato=".txt" longitud="8374">
       </tf:texto>
    </tf:informacionSalida>

</tf:sistemaTF>