<?xml version="1.0" encoding="UTF-8" standalone="no"?>
<!-- SISTEMA-TRANSFORMACION-MIGUEL-AMARÍS -->
<tf:sistemaTF xmlns:tf="http://www.piat.upm.es/sistemaTransformacion" 
xmlns:xsi="http://www.w3.org/2001/XMLSchema-instance" 
xsi:schemaLocation="http://www.piat.upm.es/sistemaTransformacion sistemaTransformacion.xsd" 
idSistemaTF="TF001">

    <tf:informacionEntrada>
        <tf:foto>
            <tf:distancia>234</tf:distancia>
            <tf:centro>
                <tf:longitud>0</tf:longitud>
                <tf:latitud>0</tf:latitud>
                <tf:forma>cuadrado</tf:forma>
            </tf:centro>
        </tf:foto>
    </tf:informacionEntrada>

    <tf:informacionSalida>
        <tf:imagen idImagen="IMAG001">
            <tf:dimensiones>123 123</tf:dimensiones>
            <tf:contenido formato="PNG"></tf:contenido>
        </tf:imagen>
    </tf:informacionSalida>

</tf:sistemaTF>